prism:url	dc:identifier	dc:title	prism:publicationName	prism:coverDate	citedby-count	affiliation	institution_1	country_1	fundus_in_title	pub_year	abstract
https://api.elsevier.com/content/abstract/scopus_id/80051677350	SCOPUS_ID:80051677350	Genetics and Genodermatoses	Rook's Textbook of Dermatology: Eighth Edition	2010-05-06	12	Our Lady's Hospital for Sick Children, Dublin, Ireland	Our Lady's Hospital for Sick Children	Ireland	0	2010	https://api.elsevier.com/content/abstract/scopus_id/80051677350
https://api.elsevier.com/content/abstract/scopus_id/80051702706	SCOPUS_ID:80051702706	Systemic Disease and the Skin	Rook's Textbook of Dermatology: Eighth Edition	2010-05-06	23	University of Cumbria, Lancaster, United Kingdom++Cumberland Infirmary, Carlisle, United Kingdom	University of Cumbria	United Kingdom	0	2010	https://api.elsevier.com/content/abstract/scopus_id/80051702706
https://api.elsevier.com/content/abstract/scopus_id/85032110443	SCOPUS_ID:85032110443	Uveitis: Fundamentals and Clinical Practice: Fourth Edition	Uveitis: Fundamentals and Clinical Practice: Fourth Edition	2010-04-06	18	National Eye Institute (NEI), Bethesda, United States++National Institutes of Health (NIH), Bethesda, United States	National Eye Institute (NEI)	United States	0	2010	https://api.elsevier.com/content/abstract/scopus_id/85032110443
https://api.elsevier.com/content/abstract/scopus_id/77950864849	SCOPUS_ID:77950864849	The optic nerve head in acquired optic neuropathies	Nature Reviews Neurology	2010-04-01	13	University of Melbourne, Parkville, Australia	University of Melbourne	Australia	0	2010	https://api.elsevier.com/content/abstract/scopus_id/77950864849
https://api.elsevier.com/content/abstract/scopus_id/77950548253	SCOPUS_ID:77950548253	Current applications and research progression of the retinal nerve fibre layer in multiple sclerosis using optical coherence tomography	International Journal of Ophthalmology	2010-03-01	0	Xinjiang Medical University, Urumqi, China	Xinjiang Medical University	China	0	2010	https://api.elsevier.com/content/abstract/scopus_id/77950548253
https://api.elsevier.com/content/abstract/scopus_id/84988887987	SCOPUS_ID:84988887987	The stomach	Sternberg's Diagnostic Surgical Pathology: Fifth Edition	2010-02-03	8	The University of British Columbia, Vancouver, Canada	The University of British Columbia	Canada	0	2010	https://api.elsevier.com/content/abstract/scopus_id/84988887987
https://api.elsevier.com/content/abstract/scopus_id/77953385483	SCOPUS_ID:77953385483	Optical coherence tomography as a potential readout in clinical trials	Therapeutic Advances in Neurological Disorders	2010-01-01	27	UT Southwestern Medical School, Dallas, United States	UT Southwestern Medical School	United States	0	2010	https://api.elsevier.com/content/abstract/scopus_id/77953385483
https://api.elsevier.com/content/abstract/scopus_id/77950213810	SCOPUS_ID:77950213810	Phenotypic and genotypic Helicobacter pylori clarithromycin resistance and therapeutic outcome: Benefits and limits	Journal of Antimicrobial Chemotherapy	2009-12-11	77	Università degli Studi di Foggia, Foggia, Italy	Università degli Studi di Foggia	Italy	0	2009	https://api.elsevier.com/content/abstract/scopus_id/77950213810
https://api.elsevier.com/content/abstract/scopus_id/71649092866	SCOPUS_ID:71649092866	Molecular medicine in ophthalmic care	Optometry	2009-12-01	12	Rosalind Franklin University of Medicine and Science, North Chicago, United States++VA Medical Center, -, United States	Rosalind Franklin University of Medicine and Science	United States	0	2009	https://api.elsevier.com/content/abstract/scopus_id/71649092866
https://api.elsevier.com/content/abstract/scopus_id/65549145022	SCOPUS_ID:65549145022	Are neuroendocrine tumours a feature of tuberous sclerosis? A systematic review	Endocrine-Related Cancer	2009-06-08	71	Barts and The London School of Medicine and Dentistry, London, United Kingdom++Gdanski Uniwersytet Medyczny, Gdańsk, Poland	Barts and The London School of Medicine and Dentistry	United Kingdom	0	2009	https://api.elsevier.com/content/abstract/scopus_id/65549145022
https://api.elsevier.com/content/abstract/scopus_id/66649103328	SCOPUS_ID:66649103328	Evaluation of PTPN22 polymorphisms and Vogt-Koyanagi-Harada disease in Japanese patients	Molecular Vision	2009-06-03	11	Graduate School of Medicine, Sapporo, Japan	Graduate School of Medicine	Japan	0	2009	https://api.elsevier.com/content/abstract/scopus_id/66649103328
https://api.elsevier.com/content/abstract/scopus_id/66649108315	SCOPUS_ID:66649108315	Epistatic module detection for case-control studies: A Bayesian model with a Gibbs sampling strategy	PLoS Genetics	2009-05-01	86	Tsinghua University, Beijing, China	Tsinghua University	China	0	2009	https://api.elsevier.com/content/abstract/scopus_id/66649108315
https://api.elsevier.com/content/abstract/scopus_id/77953371445	SCOPUS_ID:77953371445	Bronchogenic cyst of the stomach involved with gastric adenocarcinoma	Clinical Journal of Gastroenterology	2009-04-01	9	Anjo Kosei Hospital, Anjo, Japan++Fukuroi Municipal Hospital, Fukuroi, Japan	Anjo Kosei Hospital	Japan	0	2009	https://api.elsevier.com/content/abstract/scopus_id/77953371445
https://api.elsevier.com/content/abstract/scopus_id/78649527195	SCOPUS_ID:78649527195	Polyposis Syndromes	Textbook of Gastroenterology, Fifth Edition	2009-02-17	3	Huntsman Cancer Institute, Salt Lake City, United States++University of Utah School of Medicine, Salt Lake City, United States	Huntsman Cancer Institute	United States	0	2009	https://api.elsevier.com/content/abstract/scopus_id/78649527195
https://api.elsevier.com/content/abstract/scopus_id/69249155767	SCOPUS_ID:69249155767	Cataract development in a young patient with lathosterolosis: A clinicopathologic case report	European Journal of Ophthalmology	2009-01-01	1	Università degli Studi di Modena e Reggio Emilia, Modena, Italy	Università degli Studi di Modena e Reggio Emilia	Italy	0	2009	https://api.elsevier.com/content/abstract/scopus_id/69249155767
https://api.elsevier.com/content/abstract/scopus_id/65349097423	SCOPUS_ID:65349097423	Optic disc cupping after optic neuritis evaluated with optic coherence tomography	Eye	2009-01-01	23	Universidad de Alcala, Alcala de Henares, Spain++Hospital Ramon y Cajal, Madrid, Spain	Universidad de Alcala	Spain	0	2009	https://api.elsevier.com/content/abstract/scopus_id/65349097423
https://api.elsevier.com/content/abstract/scopus_id/67349287668	SCOPUS_ID:67349287668	A negative electroretinogram (ERG) in a case of probable multiple system atrophy (MSA)	Documenta Ophthalmologica	2009-01-01	5	Atlanta VA Medical Center, Decatur, United States++Emory University, Atlanta, United States	Atlanta VA Medical Center	United States	0	2009	https://api.elsevier.com/content/abstract/scopus_id/67349287668
https://api.elsevier.com/content/abstract/scopus_id/72749123983	SCOPUS_ID:72749123983	Variations in five genes and the severity of age-related macular degeneration: Results from the Muenster aging and retina study	Eye	2009-01-01	32	Westfälische Wilhelms-Universität Münster, Munster, Germany	Westfälische Wilhelms-Universität Münster	Germany	0	2009	https://api.elsevier.com/content/abstract/scopus_id/72749123983
https://api.elsevier.com/content/abstract/scopus_id/85014157278	SCOPUS_ID:85014157278	Caplan's Stroke	Caplan's Stroke	2009-01-01	10	Beth Israel Deaconess Medical Center, Boston, United States	Beth Israel Deaconess Medical Center	United States	0	2009	https://api.elsevier.com/content/abstract/scopus_id/85014157278
https://api.elsevier.com/content/abstract/scopus_id/85013741615	SCOPUS_ID:85013741615	Caplan's Stroke: A Clinical Approach: Fourth Edition	Caplan's Stroke: A Clinical Approach: Fourth Edition	2009-01-01	45	-	-	-	0	2009	https://api.elsevier.com/content/abstract/scopus_id/85013741615
https://api.elsevier.com/content/abstract/scopus_id/57249107934	SCOPUS_ID:57249107934	Optical coherence tomography: A window into the mechanisms of multiple sclerosis	Nature Clinical Practice Neurology	2008-12-11	223	UT Southwestern Medical School, Dallas, United States	UT Southwestern Medical School	United States	0	2008	https://api.elsevier.com/content/abstract/scopus_id/57249107934
https://api.elsevier.com/content/abstract/scopus_id/59549089180	SCOPUS_ID:59549089180	Statin adverse effects: A review of the literature and evidence for a mitochondrial mechanism	American Journal of Cardiovascular Drugs	2008-12-01	451	Department of Medicine, San Diego, United States++University of California, San Diego, San Diego, United States	Department of Medicine	United States	0	2008	https://api.elsevier.com/content/abstract/scopus_id/59549089180
https://api.elsevier.com/content/abstract/scopus_id/85058586149	SCOPUS_ID:85058586149	Drug-induced ocular side effects	Clinical Ocular Toxicology	2008-12-01	1	-	-	-	0	2008	https://api.elsevier.com/content/abstract/scopus_id/85058586149
https://api.elsevier.com/content/abstract/scopus_id/54049122543	SCOPUS_ID:54049122543	Acute and chronic responses associated with adrenomedullin administration in experimental colitis	Peptides	2008-11-01	64	University of Seville, Sevilla, Spain	University of Seville	Spain	0	2008	https://api.elsevier.com/content/abstract/scopus_id/54049122543
https://api.elsevier.com/content/abstract/scopus_id/54049146720	SCOPUS_ID:54049146720	Autoimmune gastritis	Rivista Italiana della Medicina di Laboratorio	2008-10-23	5	Azienda ULSS, Mestre, Italy++Laboratorio Analisi, Cagliar, Italy	Azienda ULSS	Italy	0	2008	https://api.elsevier.com/content/abstract/scopus_id/54049146720
https://api.elsevier.com/content/abstract/scopus_id/84927105364	SCOPUS_ID:84927105364	Jubb, kennedy and palmer's pathology of domestic animals: Fifth edition	Jubb, Kennedy and Palmer's Pathology of Domestic Animals: Fifth Edition	2008-10-01	11	-	-	-	0	2008	https://api.elsevier.com/content/abstract/scopus_id/84927105364
https://api.elsevier.com/content/abstract/scopus_id/46749097116	SCOPUS_ID:46749097116	Colorectal polyposes: From phenotype to diagnosis	Pathology Research and Practice	2008-07-25	56	St Mark’s Hospital, Harrow, United Kingdom	St Mark’s Hospital	United Kingdom	0	2008	https://api.elsevier.com/content/abstract/scopus_id/46749097116
https://api.elsevier.com/content/abstract/scopus_id/84909190896	SCOPUS_ID:84909190896	Introducing neuropsychology: Second edition	Introducing Neuropsychology: Second Edition	2008-06-20	1	-	-	-	0	2008	https://api.elsevier.com/content/abstract/scopus_id/84909190896
https://api.elsevier.com/content/abstract/scopus_id/84948069619	SCOPUS_ID:84948069619	Diagnosis and Management of Ocular Motility Disorders: Third Edition	Diagnosis and Management of Ocular Motility Disorders: Third Edition	2008-04-16	3	Manchester Royal Eye Hospital, Manchester, United Kingdom	Manchester Royal Eye Hospital	United Kingdom	0	2008	https://api.elsevier.com/content/abstract/scopus_id/84948069619
https://api.elsevier.com/content/abstract/scopus_id/44949122716	SCOPUS_ID:44949122716	Antioxidant supplements for prevention of mortality in healthy participants and patients with various diseases	Cochrane Database of Systematic Reviews	2008-01-01	351	Rigshospitalet, Copenhagen, Denmark	Rigshospitalet	Denmark	0	2008	https://api.elsevier.com/content/abstract/scopus_id/44949122716
https://api.elsevier.com/content/abstract/scopus_id/56849092125	SCOPUS_ID:56849092125	Retinal Disease	Neurology and Clinical Neuroscience	2007-12-01	1	Croydon University Hospital, Croydon, United Kingdom	Croydon University Hospital	United Kingdom	0	2007	https://api.elsevier.com/content/abstract/scopus_id/56849092125
https://api.elsevier.com/content/abstract/scopus_id/84882887908	SCOPUS_ID:84882887908	Neuro-Oculocutaneous Syndromes (Phakomatoses)	Clinical Ophthalmic Oncology	2007-12-01	1	Cleveland Clinic Foundation, Cleveland, United States	Cleveland Clinic Foundation	United States	0	2007	https://api.elsevier.com/content/abstract/scopus_id/84882887908
https://api.elsevier.com/content/abstract/scopus_id/84882828073	SCOPUS_ID:84882828073	Systemic Associations of Conjunctival and Corneal Tumors	Clinical Ophthalmic Oncology	2007-12-01	0	Cleveland Clinic Foundation, Cleveland, United States	Cleveland Clinic Foundation	United States	0	2007	https://api.elsevier.com/content/abstract/scopus_id/84882828073
https://api.elsevier.com/content/abstract/scopus_id/67649387128	SCOPUS_ID:67649387128	Tuberous sclerosis	Handbook of Clinical Neurology	2007-12-01	30	Università degli Studi di Roma Tor Vergata, Rome, Italy	Università degli Studi di Roma Tor Vergata	Italy	0	2007	https://api.elsevier.com/content/abstract/scopus_id/67649387128
https://api.elsevier.com/content/abstract/scopus_id/35748935853	SCOPUS_ID:35748935853	Gastrointestinal Polyposes: Clinical, Pathological and Molecular Features	Gastroenterology Clinics of North America	2007-12-01	36	St Mark’s Hospital, Harrow, United Kingdom	St Mark’s Hospital	United Kingdom	0	2007	https://api.elsevier.com/content/abstract/scopus_id/35748935853
https://api.elsevier.com/content/abstract/scopus_id/84895295262	SCOPUS_ID:84895295262	Deadly dermatologic diseases: Clinicopathologic atlas and text	Deadly Dermatologic Diseases: Clinicopathologic Atlas and Text	2007-12-01	0	Morsani College of Medicine, Tampa, United States++Bay Area Dermatopathology, Tampa, United States	Morsani College of Medicine	United States	0	2007	https://api.elsevier.com/content/abstract/scopus_id/84895295262
https://api.elsevier.com/content/abstract/scopus_id/34547764792	SCOPUS_ID:34547764792	Interferon retinopathy associated with hepatitis C	Clinical and Refractive Optometry	2007-08-16	0	Southern California College of Optometry, Fullerton, United States++Sepulveda Ambulatory Care Center and Nursing Home, Sepulveda, United States	Southern California College of Optometry	United States	0	2007	https://api.elsevier.com/content/abstract/scopus_id/34547764792
https://api.elsevier.com/content/abstract/scopus_id/34447291600	SCOPUS_ID:34447291600	A likelihood approach to estimating sensitivity and specificity for binocular data: Application in ophthalmology	Statistics in Medicine	2007-07-30	5	University of Calgary, Calgary, Canada	University of Calgary	Canada	0	2007	https://api.elsevier.com/content/abstract/scopus_id/34447291600
https://api.elsevier.com/content/abstract/scopus_id/34548303657	SCOPUS_ID:34548303657	Urinary neopterin levels in uveitis: Is it a new activity marker?	Ocular Immunology and Inflammation	2007-07-01	7	Gulhane Military Medical Academy, Ankara, Turkey	Gulhane Military Medical Academy	Turkey	0	2007	https://api.elsevier.com/content/abstract/scopus_id/34548303657
https://api.elsevier.com/content/abstract/scopus_id/38049162421	SCOPUS_ID:38049162421	Occular complications in sickle cell disease	Revista Brasileira de Hematologia e Hemoterapia	2007-07-01	5	Universidade Federal de Alagoas, Maceio, Brazil	Universidade Federal de Alagoas	Brazil	0	2007	https://api.elsevier.com/content/abstract/scopus_id/38049162421
https://api.elsevier.com/content/abstract/scopus_id/34250358302	SCOPUS_ID:34250358302	Interferon-α2a and Vogt-Koyanagi-Harada disease: A double-edged sword?	International Ophthalmology	2007-06-01	18	Hôpital Universitaire Pitié Salpêtrière, Paris, France	Hôpital Universitaire Pitié Salpêtrière	France	0	2007	https://api.elsevier.com/content/abstract/scopus_id/34250358302
https://api.elsevier.com/content/abstract/scopus_id/33847021802	SCOPUS_ID:33847021802	Diseases caused by defects in the visual cycle: Retinoids as potential therapeutic agents	Annual Review of Pharmacology and Toxicology	2007-02-23	295	David Geffen School of Medicine at UCLA, Los Angeles, United States	David Geffen School of Medicine at UCLA	United States	0	2007	https://api.elsevier.com/content/abstract/scopus_id/33847021802
https://api.elsevier.com/content/abstract/scopus_id/85013840016	SCOPUS_ID:85013840016	Jubb, Kennedy &amp; Palmer's Pathology of Domestic Animals	Jubb, Kennedy &amp; Palmer's Pathology of Domestic Animals	2007-01-01	67	University of Guelph, Guelph, Canada	University of Guelph	Canada	0	2007	https://api.elsevier.com/content/abstract/scopus_id/85013840016
https://api.elsevier.com/content/abstract/scopus_id/33845971298	SCOPUS_ID:33845971298	Clinical observation of intravitreal injection of triamcinolone acetonide for macular edema secondary to retinal vein occlusion	Chinese Ophthalmic Research	2006-12-01	2	Peking University People's Hospital, Beijing, China	Peking University People's Hospital	China	0	2006	https://api.elsevier.com/content/abstract/scopus_id/33845971298
https://api.elsevier.com/content/abstract/scopus_id/33750497434	SCOPUS_ID:33750497434	Unraveling A Complex Genetic Disease: Age-related Macular Degeneration	Survey of Ophthalmology	2006-11-01	32	University of Melbourne, Parkville, Australia	University of Melbourne	Australia	0	2006	https://api.elsevier.com/content/abstract/scopus_id/33750497434
https://api.elsevier.com/content/abstract/scopus_id/37849185489	SCOPUS_ID:37849185489	Bilateral panuveitis in neurosarcoidosis with spinal cord involvement	Asian Journal of Ophthalmology	2006-10-01	0	Karadeniz Technical University, Trabzon, Turkey	Karadeniz Technical University	Turkey	0	2006	https://api.elsevier.com/content/abstract/scopus_id/37849185489
https://api.elsevier.com/content/abstract/scopus_id/33750592482	SCOPUS_ID:33750592482	Optical coherence tomography in multiple sclerosis	Lancet Neurology	2006-10-01	134	UT Southwestern Medical Center, Dallas, United States	UT Southwestern Medical Center	United States	0	2006	https://api.elsevier.com/content/abstract/scopus_id/33750592482
https://api.elsevier.com/content/abstract/scopus_id/33748703859	SCOPUS_ID:33748703859	The endocannabinoid system as an emerging target of pharmacotherapy	Pharmacological Reviews	2006-09-21	1408	National Institute on Alcohol Abuse and Alcoholism (NIAAA), Bethesda, United States	National Institute on Alcohol Abuse and Alcoholism (NIAAA)	United States	0	2006	https://api.elsevier.com/content/abstract/scopus_id/33748703859
https://api.elsevier.com/content/abstract/scopus_id/33748300958	SCOPUS_ID:33748300958	Interferon retinopathy associated with hepatitis C	Clinical and Refractive Optometry	2006-09-11	1	Southern California College of Optometry, Fullerton, United States++Sepulveda Ambulatory Care Center and Nursing Home, Sepulveda, United States	Southern California College of Optometry	United States	0	2006	https://api.elsevier.com/content/abstract/scopus_id/33748300958
https://api.elsevier.com/content/abstract/scopus_id/84895317506	SCOPUS_ID:84895317506	Bioregenerative Engineering: Principles and Applications	Bioregenerative Engineering: Principles and Applications	2006-08-24	16	-	-	-	0	2006	https://api.elsevier.com/content/abstract/scopus_id/84895317506
https://api.elsevier.com/content/abstract/scopus_id/33344479399	SCOPUS_ID:33344479399	The effect of genetic diversity on angiogenesis	Experimental Cell Research	2006-03-10	56	Children's Hospital Boston, Boston, United States	Children's Hospital Boston	United States	0	2006	https://api.elsevier.com/content/abstract/scopus_id/33344479399
https://api.elsevier.com/content/abstract/scopus_id/84882504897	SCOPUS_ID:84882504897	McAlpine's Multiple Sclerosis	McAlpine's Multiple Sclerosis	2006-01-01	208	University of Cambridge, Cambridge, United Kingdom	University of Cambridge	United Kingdom	0	2006	https://api.elsevier.com/content/abstract/scopus_id/84882504897
https://api.elsevier.com/content/abstract/scopus_id/84929875736	SCOPUS_ID:84929875736	A practical guide to human cancer genetics, third edition	A Practical Guide to Human Cancer Genetics, Third Edition	2006-01-01	3	St George's Hospital, London, United Kingdom	St George's Hospital	United Kingdom	0	2006	https://api.elsevier.com/content/abstract/scopus_id/84929875736
https://api.elsevier.com/content/abstract/scopus_id/33748287949	SCOPUS_ID:33748287949	Diseases of the Ocular Posterior Segment	Equine Ophthalmology	2005-12-01	5	The Ohio State University, Columbus, United States	The Ohio State University	United States	0	2005	https://api.elsevier.com/content/abstract/scopus_id/33748287949
https://api.elsevier.com/content/abstract/scopus_id/84879735408	SCOPUS_ID:84879735408	Cardiovascular Disorders	Textbook of Clinical Occupational and Environmental Medicine	2005-12-01	11	National Institutes of Health (NIH), Bethesda, United States	National Institutes of Health (NIH)	United States	0	2005	https://api.elsevier.com/content/abstract/scopus_id/84879735408
https://api.elsevier.com/content/abstract/scopus_id/33847118352	SCOPUS_ID:33847118352	Coats' Disease	Retina: Fourth Edition	2005-09-27	6	Wilmer Eye Institute, Baltimore, United States	Wilmer Eye Institute	United States	0	2005	https://api.elsevier.com/content/abstract/scopus_id/33847118352
https://api.elsevier.com/content/abstract/scopus_id/27244455446	SCOPUS_ID:27244455446	Sequencing arrays for screening multiple genes associated with early-onset human retinal degenerations on a high-throughput platform	Investigative Ophthalmology and Visual Science	2005-09-01	52	University of Michigan, Ann Arbor, Ann Arbor, United States	University of Michigan, Ann Arbor	United States	0	2005	https://api.elsevier.com/content/abstract/scopus_id/27244455446
https://api.elsevier.com/content/abstract/scopus_id/21744432840	SCOPUS_ID:21744432840	Intrauterine growth restriction - Etiology and consequences: What do we know about the human situation and experimental animal models?	Reproductive Toxicology	2005-09-01	124	Hebrew University-Hadassah Medical School, Jerusalem, Israel++Hadassah University Medical Centre, Jerusalem, Israel	Hebrew University-Hadassah Medical School	Israel	0	2005	https://api.elsevier.com/content/abstract/scopus_id/21744432840
https://api.elsevier.com/content/abstract/scopus_id/26244459662	SCOPUS_ID:26244459662	Glycoconjugates of choroidal neovascular membranes in age-related macular degeneration	Molecular Vision	2005-07-14	15	University of Iowa Carver College of Medicine, Iowa City, IA, United States	University of Iowa Carver College of Medicine	United States	0	2005	https://api.elsevier.com/content/abstract/scopus_id/26244459662
https://api.elsevier.com/content/abstract/scopus_id/23844540967	SCOPUS_ID:23844540967	Drug transport in the respiratory epithelium	Pneumologie	2005-07-01	4	Charité – Universitätsmedizin Berlin, Berlin, Germany++Medizinische Hochschule Hannover (MHH), Hannover, Germany	Charité – Universitätsmedizin Berlin	Germany	0	2005	https://api.elsevier.com/content/abstract/scopus_id/23844540967
https://api.elsevier.com/content/abstract/scopus_id/22044445428	SCOPUS_ID:22044445428	Recovery of sickle cell disease ischemic maculopathy after erythropheresis: A clinical case study	Journal Francais d'Ophtalmologie	2005-01-01	5	Hopital de Bicetre, Le Kremlin-Bicetre, France	Hopital de Bicetre	France	0	2005	https://api.elsevier.com/content/abstract/scopus_id/22044445428
https://api.elsevier.com/content/abstract/scopus_id/12344266657	SCOPUS_ID:12344266657	Surgery for gastroenteropancreatic tumours in multiple endocrine neoplasia type 1: Review and personal experience	Journal of Internal Medicine	2005-01-01	41	Università degli Studi di Firenze, Florence, Italy	Università degli Studi di Firenze	Italy	0	2005	https://api.elsevier.com/content/abstract/scopus_id/12344266657
https://api.elsevier.com/content/abstract/scopus_id/77950485576	SCOPUS_ID:77950485576	Cutaneous syndromes with intestinal polyposis	Piel	2005-01-01	1	Hospital Nacional Professor Dr. Alejandro Posadas, Buenos Aires, Argentina	Hospital Nacional Professor Dr. Alejandro Posadas	Argentina	0	2005	https://api.elsevier.com/content/abstract/scopus_id/77950485576
https://api.elsevier.com/content/abstract/scopus_id/13544277362	SCOPUS_ID:13544277362	Hereditary cancer syndromes of the skin	Clinics in Dermatology	2005-01-01	14	Harvard Medical School, Boston, United States	Harvard Medical School	United States	0	2005	https://api.elsevier.com/content/abstract/scopus_id/13544277362
https://api.elsevier.com/content/abstract/scopus_id/9944240340	SCOPUS_ID:9944240340	The eye in neurological disease	Lancet	2004-12-04	12	Wilmer Eye Institute, Baltimore, United States++The Johns Hopkins Hospital, Baltimore, United States	Wilmer Eye Institute	United States	0	2004	https://api.elsevier.com/content/abstract/scopus_id/9944240340
https://api.elsevier.com/content/abstract/scopus_id/4444292985	SCOPUS_ID:4444292985	Highly penetrant hereditary cancer syndromes	Oncogene	2004-08-23	219	The Ohio State University, Columbus, United States++The Ohio State University Comprehensive Cancer Center, Columbus, United States	The Ohio State University	United States	0	2004	https://api.elsevier.com/content/abstract/scopus_id/4444292985
https://api.elsevier.com/content/abstract/scopus_id/1242296361	SCOPUS_ID:1242296361	Evidence-Based Appraisal of Antireflux Fundoplication	Annals of Surgery	2004-03-01	239	Azienda Complesso Ospedaliero San Filippo Neri, Rome, Italy++UOC Chir. Generale and Oncologica, Rome, Italy	Azienda Complesso Ospedaliero San Filippo Neri	Italy	0	2004	https://api.elsevier.com/content/abstract/scopus_id/1242296361
https://api.elsevier.com/content/abstract/scopus_id/1642445327	SCOPUS_ID:1642445327	Bilateral uveitis intermedia	Ophthalmologe	2003-12-01	2	University of Cologne, Koln, Germany	University of Cologne	Germany	0	2003	https://api.elsevier.com/content/abstract/scopus_id/1642445327
https://api.elsevier.com/content/abstract/scopus_id/0037395197	SCOPUS_ID:0037395197	Gastrointestinal inherited polyposis syndromes	Modern Pathology	2003-04-01	12	University of Washington School of Medicine, Seattle, United States++University of Washington, Seattle, United States	University of Washington School of Medicine	United States	0	2003	https://api.elsevier.com/content/abstract/scopus_id/0037395197
